{"audit_software_identity":"git:97bce032b351f95e11d78352b74fe5f2098f8834","bindings":{"boundary_evidence_sha256":"d39bfaa6abb377cc6553b5b55de4eabb7d5df91a373eb5c134945583424229de","canonical_manifest_sha256":"55ccedfaa84e611ab704553843027b7054e389b7f4930239351a75406703e50f","capacity_evidence_sha256":"2363e5795c108186764f098e572388c6bf61185f77ab342c07e1fc61b2ac46d0","funding_manifest_sha256":"5c377afcbf8754a6a705676e718d2b4c797e1f4587f63c4faaaf4c13f005b620","instrument_registry_sha256":"4024ded8a34718e6658dcddd34b290f757b030e6c34b07401568b8aeadae910d","publisher_software_identity":"git:cbe8391db0b9d5b9bdeb9ebae5af4035e570a7e2"},"chronology_anomaly_evidence":{"anomaly_count":0,"anomaly_records_sha256":"4f53cda18c2baa0c0354bb5f9a3ecbe5ed12ab4d8e11ba873c2f11161202b945"},"content_sha256":"55042e00385538c0762a204311255dd8c916fe0aca383c44f6520ef6affa742f","contract":"grid.canonical-funding-coverage-audit/v1","coverage_basis":{"current_instrument_interval_used":false,"empty_range_windows_accepted":false,"endpoint":"/v5/market/funding/history","historical_interval_evidence":"predecessor-and-adjacent-settlements","interval_changes_accepted_without_dated_evidence":false,"range_pages_have_explicit_bounds":true,"saturated_range_pages_accepted":false},"dataset_id":"funding-5c377afcbf8754a6a705676e","dataset_type":"funding_event","generated_at_utc":"2026-08-13T07:16:18.235246Z","limitations":["Coverage is evaluated only inside explicitly requested source windows.","Unsaturated endpoint enumeration proves the retained Bybit source response, not an independently sourced exchange ledger.","Any empty source window or observed cadence change remains blocked until dated evidence or a separately accepted policy explains it.","Current instrument fundingInterval metadata is not used as historical evidence.","This audit does not repair, compact, catalog, accept Gate 2, or authorize private or live operations."],"quality":{"boundary_page_count":2,"canonical_source_table_equal":true,"conflicting_key_count":0,"duplicate_key_count":0,"empty_range_page_count":0,"internal_interval_mismatch_count":0,"interval_change_count":0,"lifecycle_failure_count":0,"observed_event_count":42,"predecessor_interval_mismatch_count":0,"range_page_count":2,"requested_window_minutes":20160,"source_range_enumeration_complete":true,"unexpected_timestamp_count":0,"unrequested_row_count":0},"reason_policy":{"accepted_reason_codes":[],"observed_reason_counts":{},"unaccepted_reason_codes":[],"unknown_reason_count":0},"series":[{"boundary_page_count":1,"duplicate_key_count":0,"empty_range_page_count":0,"end_ms":1783468740000,"instrument_id":5,"internal_interval_mismatch_count":0,"interval_change_count":0,"interval_histogram":[{"event_count":21,"interval_minutes":480}],"observed_event_count":21,"predecessor_interval_mismatch_count":0,"range_page_count":1,"requested_window_minutes":10080,"stable_observed_interval_minutes":480,"start_ms":1782864000000,"symbol":"BTCUSDT","unexpected_timestamp_count":0,"within_registry_lifecycle_bounds":true},{"boundary_page_count":1,"duplicate_key_count":0,"empty_range_page_count":0,"end_ms":1783468740000,"instrument_id":29,"internal_interval_mismatch_count":0,"interval_change_count":0,"interval_histogram":[{"event_count":21,"interval_minutes":480}],"observed_event_count":21,"predecessor_interval_mismatch_count":0,"range_page_count":1,"requested_window_minutes":10080,"stable_observed_interval_minutes":480,"start_ms":1782864000000,"symbol":"UNIUSDT","unexpected_timestamp_count":0,"within_registry_lifecycle_bounds":true}],"status":"passed","storage_policy":{"account_data_included":false,"funding_rates_included":false,"observed_settlement_timestamps_included":false,"runtime_paths_included":false}}
