{"audit_software_identity":"git:241928fd1301ece26b60495f12375f603dcd0777","bindings":{"boundary_evidence_sha256":"5b30efb498521892fa6e36d9522faa46abc80b7acb40df307875721ddfdbf07b","canonical_manifest_sha256":"f6d25b8a82d554fb73b2462045bb422a788e14fcd873bcd0a7ae01b87dd13c82","capacity_evidence_sha256":"2363e5795c108186764f098e572388c6bf61185f77ab342c07e1fc61b2ac46d0","funding_manifest_sha256":"79806232161e91d29db3be99e8d2cab535c5b1ec05b6118df4020985777ff0c5","instrument_registry_sha256":"4024ded8a34718e6658dcddd34b290f757b030e6c34b07401568b8aeadae910d","publisher_software_identity":"git:241928fd1301ece26b60495f12375f603dcd0777"},"chronology_anomaly_evidence":{"anomaly_count":0,"anomaly_records_sha256":"4f53cda18c2baa0c0354bb5f9a3ecbe5ed12ab4d8e11ba873c2f11161202b945"},"content_sha256":"6ce0c358b10374fd80620e46e5fef2637eb8deb1f2a76238e5f11188864ffc76","contract":"grid.canonical-funding-coverage-audit/v1","coverage_basis":{"current_instrument_interval_used":false,"empty_range_windows_accepted":false,"endpoint":"/v5/market/funding/history","historical_interval_evidence":"predecessor-and-adjacent-settlements","interval_changes_accepted_without_dated_evidence":false,"range_pages_have_explicit_bounds":true,"saturated_range_pages_accepted":false},"dataset_id":"funding-79806232161e91d29db3be99","dataset_type":"funding_event","generated_at_utc":"2026-08-13T07:49:27.058509Z","limitations":["Coverage is evaluated only inside explicitly requested source windows.","Unsaturated endpoint enumeration proves the retained Bybit source response, not an independently sourced exchange ledger.","Any empty source window or observed cadence change remains blocked until dated evidence or a separately accepted policy explains it.","Current instrument fundingInterval metadata is not used as historical evidence.","This audit does not repair, compact, catalog, accept Gate 2, or authorize private or live operations."],"quality":{"boundary_page_count":10,"canonical_source_table_equal":true,"conflicting_key_count":0,"duplicate_key_count":0,"empty_range_page_count":0,"internal_interval_mismatch_count":0,"interval_change_count":0,"lifecycle_failure_count":0,"observed_event_count":231,"predecessor_interval_mismatch_count":0,"range_page_count":10,"requested_window_minutes":100800,"source_range_enumeration_complete":true,"unexpected_timestamp_count":0,"unrequested_row_count":0},"reason_policy":{"accepted_reason_codes":[],"observed_reason_counts":{},"unaccepted_reason_codes":[],"unknown_reason_count":0},"series":[{"boundary_page_count":1,"duplicate_key_count":0,"empty_range_page_count":0,"end_ms":1783468740000,"instrument_id":5,"internal_interval_mismatch_count":0,"interval_change_count":0,"interval_histogram":[{"event_count":21,"interval_minutes":480}],"observed_event_count":21,"predecessor_interval_mismatch_count":0,"range_page_count":1,"requested_window_minutes":10080,"stable_observed_interval_minutes":480,"start_ms":1782864000000,"symbol":"BTCUSDT","unexpected_timestamp_count":0,"within_registry_lifecycle_bounds":true},{"boundary_page_count":1,"duplicate_key_count":0,"empty_range_page_count":0,"end_ms":1783468740000,"instrument_id":29,"internal_interval_mismatch_count":0,"interval_change_count":0,"interval_histogram":[{"event_count":21,"interval_minutes":480}],"observed_event_count":21,"predecessor_interval_mismatch_count":0,"range_page_count":1,"requested_window_minutes":10080,"stable_observed_interval_minutes":480,"start_ms":1782864000000,"symbol":"UNIUSDT","unexpected_timestamp_count":0,"within_registry_lifecycle_bounds":true},{"boundary_page_count":1,"duplicate_key_count":0,"empty_range_page_count":0,"end_ms":1783468740000,"instrument_id":37,"internal_interval_mismatch_count":0,"interval_change_count":0,"interval_histogram":[{"event_count":21,"interval_minutes":480}],"observed_event_count":21,"predecessor_interval_mismatch_count":0,"range_page_count":1,"requested_window_minutes":10080,"stable_observed_interval_minutes":480,"start_ms":1782864000000,"symbol":"FILUSDT","unexpected_timestamp_count":0,"within_registry_lifecycle_bounds":true},{"boundary_page_count":1,"duplicate_key_count":0,"empty_range_page_count":0,"end_ms":1783468740000,"instrument_id":53,"internal_interval_mismatch_count":0,"interval_change_count":0,"interval_histogram":[{"event_count":21,"interval_minutes":480}],"observed_event_count":21,"predecessor_interval_mismatch_count":0,"range_page_count":1,"requested_window_minutes":10080,"stable_observed_interval_minutes":480,"start_ms":1782864000000,"symbol":"CHZUSDT","unexpected_timestamp_count":0,"within_registry_lifecycle_bounds":true},{"boundary_page_count":1,"duplicate_key_count":0,"empty_range_page_count":0,"end_ms":1783468740000,"instrument_id":85,"internal_interval_mismatch_count":0,"interval_change_count":0,"interval_histogram":[{"event_count":21,"interval_minutes":480}],"observed_event_count":21,"predecessor_interval_mismatch_count":0,"range_page_count":1,"requested_window_minutes":10080,"stable_observed_interval_minutes":480,"start_ms":1782864000000,"symbol":"EGLDUSDT","unexpected_timestamp_count":0,"within_registry_lifecycle_bounds":true},{"boundary_page_count":1,"duplicate_key_count":0,"empty_range_page_count":0,"end_ms":1783468740000,"instrument_id":101,"internal_interval_mismatch_count":0,"interval_change_count":0,"interval_histogram":[{"event_count":21,"interval_minutes":480}],"observed_event_count":21,"predecessor_interval_mismatch_count":0,"range_page_count":1,"requested_window_minutes":10080,"stable_observed_interval_minutes":480,"start_ms":1782864000000,"symbol":"WOOUSDT","unexpected_timestamp_count":0,"within_registry_lifecycle_bounds":true},{"boundary_page_count":1,"duplicate_key_count":0,"empty_range_page_count":0,"end_ms":1783468740000,"instrument_id":117,"internal_interval_mismatch_count":0,"interval_change_count":0,"interval_histogram":[{"event_count":42,"interval_minutes":240}],"observed_event_count":42,"predecessor_interval_mismatch_count":0,"range_page_count":1,"requested_window_minutes":10080,"stable_observed_interval_minutes":240,"start_ms":1782864000000,"symbol":"IMXUSDT","unexpected_timestamp_count":0,"within_registry_lifecycle_bounds":true},{"boundary_page_count":1,"duplicate_key_count":0,"empty_range_page_count":0,"end_ms":1783468740000,"instrument_id":149,"internal_interval_mismatch_count":0,"interval_change_count":0,"interval_histogram":[{"event_count":21,"interval_minutes":480}],"observed_event_count":21,"predecessor_interval_mismatch_count":0,"range_page_count":1,"requested_window_minutes":10080,"stable_observed_interval_minutes":480,"start_ms":1782864000000,"symbol":"KAVAUSDT","unexpected_timestamp_count":0,"within_registry_lifecycle_bounds":true},{"boundary_page_count":1,"duplicate_key_count":0,"empty_range_page_count":0,"end_ms":1783468740000,"instrument_id":157,"internal_interval_mismatch_count":0,"interval_change_count":0,"interval_histogram":[{"event_count":21,"interval_minutes":480}],"observed_event_count":21,"predecessor_interval_mismatch_count":0,"range_page_count":1,"requested_window_minutes":10080,"stable_observed_interval_minutes":480,"start_ms":1782864000000,"symbol":"QNTUSDT","unexpected_timestamp_count":0,"within_registry_lifecycle_bounds":true},{"boundary_page_count":1,"duplicate_key_count":0,"empty_range_page_count":0,"end_ms":1783468740000,"instrument_id":165,"internal_interval_mismatch_count":0,"interval_change_count":0,"interval_histogram":[{"event_count":21,"interval_minutes":480}],"observed_event_count":21,"predecessor_interval_mismatch_count":0,"range_page_count":1,"requested_window_minutes":10080,"stable_observed_interval_minutes":480,"start_ms":1782864000000,"symbol":"BANDUSDT","unexpected_timestamp_count":0,"within_registry_lifecycle_bounds":true}],"status":"passed","storage_policy":{"account_data_included":false,"funding_rates_included":false,"observed_settlement_timestamps_included":false,"runtime_paths_included":false}}
